V8 Wireless Bluetooth Game Controller With Smartphone Holder , KSh 1,849 , 4 out of 5
GtyGo Wired Gaming Mouse 7 Functional Keys  RGB Light For Game , KSh 549 , 3 out of 5
UCOM Single PC USB Game Controller Pad , KSh 2,197 , 2 out of 5
GALUIN Wireless Game Controller Joystick Bluetooth BT3.0 , KSh 3,099 , 1 out of 5
R8 Mechanical Keyboard 61-key RGB Blue Switch Gaming Black , KSh 3,699 , 3.7 out of 5
Portable Mini Bluetooth Touchpad Wireless Keyboard, 3-Level Foldable Keyboard , KSh 2,700 , 4.2 out of 5
Sony PS3 Pad Dual Shock 3 - Wireless Controller , KSh 2,999 , 3.8 out of 5
Genera Controller for PS4 Slim Pro Joystick Gamepad Dual Vibration Wireless Bluetooth Joypad For PlayStation 4 Joypad PC/IOS/Android , KSh 3,690 , 4.1 out of 5
V13 Wireless Bluetooth Gamepad Game Controller With Smartphone Holder  For Phone/PS3/PS4/smart TV , KSh 2,800 , 4.4 out of 5
2Pcs Gamepad Wireless  2.4G Game Controller For PC Smart TV Box  Game Box Game Stick , KSh 1,849 , 3.7 out of 5
Mobile Bluetooth Game Controller, Precise And Fast Response , KSh 549 , 3.7 out of 5
Wireless Game Controller Joystick Bluetooth BT3.0 , KSh 665 , 5 out of 5
2.4Ghz Gamepad, Wireless Controller For PSP / PC / TV Box / Android Phone , KSh 1,052 , 5 out of 5
Portable Video Game Console, 3.5 Inch, High Definition, Large Retro Screen, With 500 Games , KSh 487 , 3.8 out of 5
1PC 2.4G Wireless Bluetooth Gamepad,Game Controller,TV Computer Remote Control , KSh 1,350 , 3.7 out of 5
General PS4 Wireless Remote Control Gamepad, Game Console Controller - LED Light -Green , KSh 2,185 , 3.3 out of 5
Gen It is price down! This game handheld has the most emulators I've ever used, and the price is astonishingly cheap , KSh 2,199 , 4 out of 5
Gen Folding Bluetooth Keyboard with Touchpad & Detachable Magnetic Stand for Tablets and Laptops , KSh 1,900 , 4.1 out of 5
Q16 Mini Camera Night Vision Portable HD Home Security Cameras for Home Office Indoor Outdoor , KSh 2,580 , 3.9 out of 5
2.4Ghz Gamepad, Wireless Controller For PSP / PC / TV Box / Android Phone , KSh 790 , 3.5 out of 5
Retro Nostalgic Mini Children's Macaron Game Console-blue , KSh 600 , 4 out of 5
Wireless Bluetooth Gamepad LED Light Game Controller WithTouch Function  For Phone/PS3/PS4/smart TV YS058 , KSh 1,800 , 3.7 out of 5
Microsoft XBOX 360 WIRED GAMEPAD/ GAME PAD/ CONTROLLER-White , KSh 1,480 , 3.8 out of 5
GALUIN Microsoft XBOX 360 WIRED GAMEPAD/ GAME PAD/ CONTROLLER-BIACK , KSh 1,350 , 5 out of 5
UBISOFT XBOX 360 Game Assasins Creed , KSh 850 - KSh 1,500 , 4 out of 5
Sony  sound bar HTS100F HTS100F HTS100F HTSF15 , KSh 1,350 , 4.7 out of 5
Wireless Bluetooth Controller For PS4 PS3 And PC Console , KSh 2,150 , 5 out of 5
Crime Scene Make Adhesive Do Not Cross For  Crime Scene Do Not Cross , KSh 1,200 , 3 out of 5
